{
  "tournament": "Copa Libertadores",
  "season": "2026",
  "format": "single-elimination",
  "render": { "scores": "legs", "box_width": 240 },
  "rounds": [
    {
      "name": "Quarterfinals",
      "matches": [
        {
          "id": "qf1",
          "home": { "team": "Flamengo" },
          "away": { "team": "Boca Juniors" },
          "legs": [
            { "ref": 84021, "home": 2, "away": 1 },
            { "ref": 84022, "home": 0, "away": 0 }
          ],
          "winner": "home"
        },
        {
          "id": "qf2",
          "home": { "team": "River Plate" },
          "away": { "team": "Palmeiras" },
          "legs": [
            { "home": 1, "away": 1 },
            { "home": 0, "away": 0, "pens": { "home": 4, "away": 2 } }
          ],
          "winner": "home"
        },
        {
          "id": "qf3",
          "home": { "team": "Montevideo City Torque" },
          "away": { "team": "Atletico Mineiro" },
          "legs": [{ "home": 1, "away": 0 }, { "home": 1, "away": 1 }],
          "winner": "home"
        },
        {
          "id": "qf4",
          "home": { "team": "Corinthians" },
          "away": { "team": "Internacional" },
          "legs": [{ "home": 3, "away": 0 }, { "home": 1, "away": 1 }],
          "winner": "home"
        }
      ]
    },
    {
      "name": "Semifinals",
      "matches": [
        {
          "id": "sf1",
          "home": { "winner_of": "qf1", "team": "Flamengo" },
          "away": { "winner_of": "qf2", "team": "River Plate" },
          "legs": [{ "home": 0, "away": 0 }, { "home": 2, "away": 1 }],
          "winner": "home"
        },
        {
          "id": "sf2",
          "home": { "winner_of": "qf3", "team": "Montevideo City Torque" },
          "away": { "winner_of": "qf4", "team": "Corinthians" },
          "legs": [{ "home": 1, "away": 1 }, { "home": 2, "away": 0 }],
          "winner": "home"
        }
      ]
    },
    {
      "name": "Final",
      "matches": [
        {
          "id": "final",
          "home": { "winner_of": "sf1", "team": "Flamengo" },
          "away": { "winner_of": "sf2", "team": "Montevideo City Torque" }
        }
      ]
    }
  ]
}
